Xfinity #2903 West Hartford,Store Experience | Staff | Manager Complaints,"Xfinity trying scam people into forcing them to purchasing their phones is unreal!!!!! I move in the area where Xfinity is one of my options I chose for internet services because my existing provider doesn't cover this area, while on the end of the call the Xfinity customer rep offers Mobile services with better pricing and all I needed was one of their sims cards to get started with their services and that my device was COMPATIBLE  on a recorded line, after giving the lady my IMEI number and she stated my phone was COMPATIBLE and she would send the sim card out to only find out it was to get me in this store asking for help to get my sim activated due to the device not being COMPATIBLE to down load the app for their services....sat in the store with my autism child while he's losing his patience just to be brushed off by Angel to his large manager for her to brush me back to Angel to tell me that I need to purchase a new phone, So I got upset and Angel couldn't understand my frustration but added more frustration to the situation while retrieving his large manager for her to complain to me how she sat with me for 40 minutes trying to help and now you must be scammed into either financing a new phone or buying one because my device was not compatible. Smh you damn right someone is going to be upset if I just explained how I need the phone importantly to handle my affairs and now I am left mwith no services, no phone, no communication to get my son his rides to therapy's. Yes, I will curse and get loud for those exact reasons. Unreal!!!!!!!!!!",1,25-Mar,2903
Xfinity #2904 Groton,Store Experience | Staff | Behaviour Issues,"After 20 great years with Verizon i switched to xfinity, lured by lower rates and a payback promo for my old phones. The payback promo would be $1091 back to me. However, it is never going to happen!!!  4 visits and almost 5 hours  to the Groton store has yielded nothing. No one can help.  All I’ve gotten is runaround, excuses, and outright rudeness. Avoid!  Stick with your current carrier, even if you are paying more. If you have xfinity, do not use this store.",1,25-Feb,2904
Xfinity #2905 North Haven,Store Experience | Customer Dissatisfaction,Terrible customer service you can't get anyone on the phone had to go into the office store of Xfinity and waited an hour to see someone,1,25-Mar,2905
Xfinity #2905 North Haven,Store Experience | Long Wait Time,Horrible experience. Stand in cold to await a door opening at 10 am only to be sitting almost 30 min for someone to handle my equipment return. Take 5 seconds to return but there is no order in how or who is caller next.  Speak up or be passed over.,1,25-Feb,2905
Xfinity #2905 North Haven,Store Experience | Long Wait Time,"I am 100% dissatisfied with this store. This was our first visit and the store RUDE employee, Stephanie, refused to accept the return of a garbage modem. After a long wait time as the first employee did not know how to use an app, the RUDE Stephanie came and surprisingly, refused to accept the return. How come? Haven't you trained how to treat customers? We will escalate this issue to Xfinity's HQ level. That rude employee should learn a good lesson on how to treat the customers.
Never ever go back to this garbage place.

===

Update: I was provided with a link to start a conversation. After explaining the problem, the link became null.",1,25-Feb,2905
Xfinity #2905 North Haven,Store Experience | Staff | Appreciation,"Meeka, David, Josh are new, and did an A+/Superlative job with customer service, being highly helpful, amiable, customer dedicated, taking care of the job timely and accurately.  Best customer service I ever got has been from these three, who are new, yet do their jobs wonderfully.

1/23/25",5,25-Feb,2905
Xfinity #2905 North Haven,Store Experience | Staff | Appreciation,Stephanie and Lorece were fantastic and patient while helping us upgrade our phones and switch mobile plans.,5,25-Feb,2905
Xfinity #2907 Springfield,Store Experience | Long Wait Time,U guys need more customer service people in this store! The wait is never less then a hour! Terrible!,1,25-Feb,2907
Xfinity #2907 Springfield,Store Experience | Staff | Appreciation,BRIANA is the hottest and most courteous sales rep here. Nice xfinity bags.,5,25-Mar,2907
Xfinity #2907 Springfield,Store Experience | Staff | Appreciation,The gentleman fit me in quickly and professionally.,5,25-Mar,2907
Xfinity #2908 Waterbury,Store Experience | Customer Appreciation,Customer service friendly all issues were resolved with one visit,4,25-Mar,2908
Xfinity #2908 Waterbury,Store Experience | Long Wait Time,The wait time is crazy,1,25-Jan,2908
Xfinity #2908 Waterbury,Store Experience | Staff | Appreciation,"I don’t usually leave reviews, but I just wanted to say what a good experience I had with the Waterbury location yesterday. I scheduled an appointment and after a 10 minute wait I was helped. Denisse was my consultant and she was very pleasant and helpful. My situation was resolved to my satisfaction.",5,25-Feb,2908
Xfinity #2910 Holyoke,Store Experience | Long Wait Time,"waked into this branch today ,JAN 2025  At Holyoke Mall  i had a question about my account but i walked out ,i saw to  Xfinity workers when they were done helping customers walk right in the back room would not even help other people waiting  that is not right, was no reason for that at all [they saw how busy it was}.i never complain but after seeing this it was like not right",1,25-Jan,2910
Xfinity #2912 Williston,Store Experience | Customer Dissatisfaction,Had an excellent experience with Long Le. He was personable and effective. Had recently been at the store the week before and was not given correct info. Long was able to fix my issue and provided additional help.,5,25-Feb,2912
Xfinity #2912 Williston,Store Experience | Long Wait Time,Long Le was amazing. We were there for a long time setting up three phone lines. He was patient and clear. I highly recommend Xfinity. I am very pleased with their customer service.,5,25-Mar,2912
Xfinity #2912 Williston,Store Experience | Staff | Appreciation,Excellent competent and friendly service,5,25-Jan,2912
Xfinity #2912 Williston,Store Experience | Staff | Appreciation,I received excellent service from Long Le at this store. I had to make an appointment but he really knew the systems and options.,5,25-Feb,2912
Xfinity #2912 Williston,Store Experience | Staff | Appreciation,Long Le - helped me back in the spring and when I came in today he took great care of me and made everything easy and seamless. Thank you!!,5,25-Feb,2912
Xfinity #2912 Williston,Store Experience | Staff | Appreciation,Long Le has helped me on a few different occasions over the last year and he always provides the fastest and easiest solutions to any problem I bring in. He has helped me save hundreds by hooking me up with only the services I need and dropping the extras that always contribute to unnecessary costs. I always appreciate his depth of knowledge and willingness to avoid calling the generic customer service line that NEVER provides answers to your problems.  Thank you Long Le,5,25-Feb,2912
Xfinity #2912 Williston,Store Experience | Staff | Appreciation,"Long Le is great. I needed service asap so I had to go in without an appt. After waiting for 74 minutes, I was a little annoyed. Long Le was super helpful and welcoming. I left satisfied and taken care of. Long Le was a phenomenal rep.",5,25-Mar,2912
Xfinity #2912 Williston,Store Experience | Staff | Appreciation,Long Le was great and super helpful,5,25-Feb,2912
Xfinity #2912 Williston,Store Experience | Staff | Appreciation,Long le was very helpful in helping us with our account and was knowledgeable on our wants.I would go to him anytime. Thank you,5,25-Feb,2912
Xfinity #2912 Williston,Store Experience | Staff | Appreciation,Long Le was very professional and super helpful! Great customer service!,5,25-Feb,2912
Xfinity #2912 Williston,Store Experience | Staff | Appreciation,"Our experience at Xfinity was really great. Long Le was very helpful, patient, thorough and pleasant to work with. We will be looking to work with him any time we need additional services from Xfinity and we highly recommend him.",5,25-Mar,2912
Xfinity #2912 Williston,Store Experience | Staff | Appreciation,"Our experience with long at the Xfinity store Was excellent he was very thorough and was able to reduce our budget on our phones and also get us some exciting deals on Apple watches and also was able to look at veterans benefits within Xfinity, which are by the way excellent. Highly recommend going in to speak with long There at the Xfinity store. He is excellent.",5,25-Jan,2912
Xfinity #2912 Williston,Store Experience | Staff | Appreciation,Stopped in and was promptly helped by Long Le. Great rep! Solved in 10 minutes what phone support couldn't after 2 hours.,5,25-Jan,2912
Xfinity #2912 Williston,Store Experience | Staff | Appreciation,Very helpful.,5,25-Jan,2912
Xfinity #2912 Williston,Store Experience | Staff | Appreciation,"Was amazing, made everything easy and helped get more than what I came in for",5,25-Jan,2912
Xfinity #2912 Williston,Store Experience | Staff | Behaviour Issues,"I worked with Long Le and he was amazing. He is kind, professional, knowledgable, empathetic and of course…techy. Loved working with him!",5,25-Feb,2912
Xfinity #2912 Williston,Store Experience | Staff | Manager Complaints,"This place is disgusting, I worked here for 4 months, all this company does is manipulate people & take advantage of old folk,
Management gave me the wrong sales ID when I started, Had to fight for my last commission check, never had ACCESS to see what I was making my manager also lied to me during the interview regarding scheduling, you will end up working every weekend and having no work-life balance.
Stay away from this company. DO NOT WORK HERE.",1,25-Jan,2912
Xfinity #3102 Oakland,Store Experience | Staff | Appreciation,Good service.,4,25-Feb,3102
Xfinity #3102 Oakland,Store Experience | Staff | Appreciation,Quick & professional.,5,25-Mar,3102
Xfinity #3102 Oakland,Store Experience | Staff | Appreciation,"We went to this store for my kid’s new phone. Lerrell was the one who helped us out. He was super thorough about the whole thing. Not only he took care of the phone, he took care of everything else that we had. He gave lots of different option. I always have a pleasant experience at this store, but Lerrell is simply the best. He is a very nice young man who is very kind and hard working.",5,25-Feb,3102
Xfinity #3102 Oakland,Store Experience | Staff | Dissatisfaction,"The store and employees themselves are fine, but Xfinity is absolutely the worst internet and phone provider on the planet! They will rip you off at every turn, so don't fall for the scam! T-Mobile, if available in your area, is much more competitive and easier to deal with, but even AT&T or other providers are head and shoulders above these crooks.",1,25-Mar,3102
Xfinity #3103 Union City,Store Experience | Long Wait Time,"This office staff are friendly but have no idea what they are doing…
i drove far and took days off to visit the office and made appointments 2 times no one showed up.
i was there again yesterday 12/21 the guy told me the appointment is today Sunday . i wait & wait no one showed up again .
Horrible ! The guy came yesterday and left he didn’t speak English and forgot to bring a cord. what a joke!
I regretted i joined xfinity this year. Why there is such a disorganized company exists … Horrible & charge me for not showing up . i don’t care if the price is a bit cheaper i will find alternative to leave this company . i am not there is racist in America but definitely there is . 100% same race in the office . it need to diversified otherwise it is racist",1,25-Jan,3103
Xfinity #3103 Union City,Store Experience | Staff | Appreciation,"I went in today to help my grandfather with his internet and cable service and was helped out by Khalil today. He was absolutely wonderful and totally took care of us. Super friendly, and kind service from all in there today but especially Khalil.",5,25-Feb,3103
Xfinity #3103 Union City,Store Experience | Staff | Appreciation,Place people are very pleasant ☺️,5,25-Mar,3103
Xfinity #3105 Richmond,Store Experience | Customer Dissatisfaction,"Honestly, I dreaded coming back to Comcast years ago. As a company they've always been a problem for me. But not this particular store, the staff here has been great, super helpful. Hopefully they'll be able to fix the most recent issue when they open on 12/26.",5,25-Jan,3105
Xfinity #3105 Richmond,Store Experience | Long Wait Time,Line was tooooooo long! I left in a hurry. I gave the a 2 because they were open.,2,25-Jan,3105
Xfinity #3105 Richmond,Store Experience | Staff | Appreciation,It was a great experience. Customer Agent was very helpful and friendly.,5,25-Mar,3105
Xfinity #3105 Richmond,Store Experience | Staff | Behaviour Issues,Guard is very rude. He tries you to go somewhere else,1,25-Jan,3105
Xfinity #3105 Richmond,Store Experience | Staff | Dissatisfaction,"The store and employees themselves are fine, but Xfinity is absolutely the worst internet and phone provider on the planet! They will rip you off at every turn, so don't fall for the scam! T-Mobile, if available in your area, is much more competitive and easier to deal with, but even AT&T or other providers are head and shoulders above these crooks.",1,25-Mar,3105
Xfinity #3106 Santa Rosa,Store Experience | Long Wait Time,An hour wait and we are not allowed to use their bathrooms?!?!?! For the amount I pay each month I should have my own personal bathroom.  This is cruel.,1,25-Feb,3106
Xfinity #3106 Santa Rosa,Store Experience | Long Wait Time,"So far I have had the absolute worst experience with Xfinity’s customer service at the Santa Rosa location. The assistant store manager Paige Fitts was very rude to us and has wasted our time every time my wife and I have gone in, since she has no desire to help their customers resolve an issue. We have now been in the store 3 times for the same problem, and had to wait 2 hours each time, just to be told there is nothing they can do for us. We traded in our old iPhones in October right after the new iPhone 16 came out. It is now January and we have an email confirmation that they have received the trade in phones back in October, a week after we sent them in. Three months later we are still getting charged $55 per phone for my wife and I. They say we just have to wait for them to process the trade in phones while they charge us $55 each per phone per month. They also “accidentally” were overcharging us an extra $20 on one of the phone lines for 3 months. This company over charges their customers and has no remorse about it. I was only supposed to be paying $75 a month for two lines and are instead getting charged $190 a month for the past three months. They have no desire to “process” our old phones because they get to charge us every month for our new phones when we shouldn’t have to pay for that, which is what they told us when we first signed up.",1,25-Jan,3106
Xfinity #3106 Santa Rosa,Store Experience | Long Wait Time,The female rep who helped gave me great service and quickly resolved my issue. We were able to right size my internet plan for a great price in about 5mins. Deducting one star for how long I had to wait in queue for a walk-in but I guess other people had appointments ahead me. So much easier to deal with a human rep than online chat or over the phone.,4,25-Feb,3106
Xfinity #3106 Santa Rosa,Store Experience | Staff | Appreciation,"The man that helped me yesterday morning, I think his name was Mike. He had dark blonde hair. He was very helpful, quick and kind.",5,25-Mar,3106
Xfinity #3106 Santa Rosa,Store Experience | Staff | Appreciation,the young gentleman juan or jose was awesome got me in and out in like 6 mins i was very grateful thank u 5 stars for juan,5,25-Mar,3106
Xfinity #3106 Santa Rosa,Store Experience | Staff | Dissatisfaction,"Pleasantly Surprised... Had to return equipment from my parents estate. Despite the initial kinda surly greeting, once I explained the situation his demeanor changed and he was quite helpful. And there was no waiting~that made my day",4,25-Mar,3106
Xfinity #3106 Santa Rosa,Store Experience | Staff | Manager Complaints,Second time I have come to store-made an appointment-still had to wait !!! Asked if I could PLEASE use the ladies room-they said no because they have important information stored in the back. Secret files!!! The manager was very snippy and said he was going to ask me to leave. I told him I am just looking for someone to explain my bill to me. The person he gave me to was a very young Hispanic girl-it was her first day-I asked her to please help me by giving me a copy of my bill-she rolled her eyes and did a tisk sound. On this experience alone I will be changing companies. Even though you are a service based company you still need customer service-I was not the only person in the store who was having trouble with the employees-I asked the manager for his card and he just disappeared into the back! I pay on the average of $210 per month-I guess that doesn’t include ANY customer service !!!! I got zero satisfaction from the 2 visits I made to this store. If you want to be treated poorly by young  people with BAD attitudes-go ahead !!!!,1,25-Feb,3106
Xfinity #3110 Truxel,Store Experience | Customer Appreciation,Nice layout to the store and customer service from all employees I encountered.,5,25-Jan,3110
Xfinity #3110 Truxel,Store Experience | Staff | Appreciation,Great service!,5,25-Mar,3110
Xfinity #3111 Modesto,Store Experience | Customer Dissatisfaction,They took more then double payment tells me after 2 proof that it's not there even though their phone service says I did wow shit people,1,25-Feb,3111
Xfinity #3111 Modesto,Store Experience | Staff | Appreciation,"They're in-store service has greatly improved. Their staff are very friendly, courteous and helpful",5,25-Feb,3111
Xfinity #3111 Modesto,Store Experience | Staff | Behaviour Issues,"If I could give negative stars, I would. The people there were rude, unhelpful and affirmatively lied.  Could not be a worse business.",1,25-Jan,3111
Xfinity #3111 Modesto,Store Experience | Staff | Dissatisfaction,Horrible people stole 212 out of my bank refused to help 'do their jobs' would never recommend evergreen there 3 times and got told nothing the could do no worries i went above the magically they found my payment shocker those people are really incompetent and should be trained,1,25-Feb,3111
Xfinity #3113 Dublin,Store Experience | Long Wait Time,"* incompetent technical staff, couldn't solve a problem, and made me wait for hour. And many hours if I include online help that had seek.
* poor escalation process at this office - I had to seek out to the manager
* VERY rude manager - didn't event want to listen to the problem at hand",1,25-Feb,3113
Xfinity #3113 Dublin,Store Experience | Staff | Dissatisfaction,Watch out the salesman are tricky,3,25-Jan,3113
Xfinity #3113 Dublin,Store Experience | Staff | Manager Complaints,"Wow the employees including the manager are so lazy! They simply lie with a straight face to avoid having to do work to help you out with any issue (including basic work like printing a receipt for you). I had to spend 3 to 4 hours with customer service on the phone to undo all the bad information and lies. They had processed on my account, even for things like a simple device return.",1,25-Mar,3113
Xfinity #3114 North Fresno,Store Experience | Staff | Behaviour Issues,"We were unfortunately stuck wi the Alberto who is a horrible customer service representative. He was uncooperative, unhelpful, and inefficient. This company jacked its monthly rates up to $260/month (for basic cable) on my elderly mother and Alberto didn’t even bother checking to see how he could help her. I doubt this location holds their staff accountable but consider training your staff like Alberto how to behave like decent human beings",1,25-Mar,3114
Xfinity #3115 San Jose,Store Experience | Clean Store,Struggled with Xfinity chat and phone support for hours over the course of days with no luck. Came into the store and had everything fixed within 10 minutes. Coming here instead of using the online/call support every time now,5,25-Jan,3115
Xfinity #3120 Brentwood,Store Experience | Customer Dissatisfaction,"Horrible horrible service. It all started with an email I got on my Comcast email which I use the blue icon on my iPhone 16+ they raised my TV bill and my Internet so I went to the app that I haven’t used in a long time they Xfinity app I forgot the password so I had to change it got the information I needed and moved on then later on I discovered I wasn’t getting any income emails or outgoing. I call on the phone for an hour and a half. The lady was nice but she couldn’t help me. She tried everything in her power so I go down to the store they were even worse, helpless, even the manager fooled with it and had me put new passcodes in Three or four times not running him on paper. I was so discouraged and he couldn’t figure it out why I wasn’t getting my emails or my outgoing so I go back in my car and I called the one 800 number again and that poor man helped me as best as he could well I’ll behold early in the morning. I got my emails to work in my incoming, but the outgoing was it. I went down there tonight. There was only two people. They were rude. They could say I was crying that was upset because I’ve been overwhelmed with this issue and I can’t figure out a life in me why these people are trained better I’m a good customer 3040 years with you guys and they can’t help me with an email problem it keeps saying either a wrong passcode or the wrong user number and it’s not it’s not wrong. Can you help me? I’m so good I want to cancel everything I have with Xfinity.",1,25-Feb,3120
Xfinity #3120 Brentwood,Store Experience | Short Wait Time,Quick and easy to walk in and get the help needed.,4,25-Feb,3120
Xfinity #3120 Brentwood,Store Experience | Staff | Appreciation,"Good, KNOWLEDGEABLE staff. Parking is ""OK""...",5,25-Mar,3120
Xfinity #3120 Brentwood,Store Experience | Staff | Appreciation,Was able to walk in was greeted by a friendly staff member and within moments trained in my old modem and got a new one. Less than 10 minutes. Service was great. People are friendly okay,5,25-Jan,3120
Xfinity #3122 San Rafael,Store Experience | Staff | Dissatisfaction,"The store and employees themselves are fine, but Xfinity is absolutely the worst internet and phone provider on the planet! They will rip you off at every turn, so don't fall for the scam! T-Mobile, if available in your area, is much more competitive and easier to deal with, but even AT&T or other providers are head and shoulders above these crooks.",1,25-Mar,3122
Xfinity #3123 Santa Cruz,Store Experience | Customer Appreciation,Always is a good place to visit and pay your bill.,5,25-Jan,3123
Xfinity #3123 Santa Cruz,Store Experience | Staff | Appreciation,Misty was so kind and helpful! Great service,5,25-Jan,3123
Xfinity #3123 Santa Cruz,Store Experience | Staff | Behaviour Issues,"Beware. These shameless con-men pressure you into a ""free phone"" offer which is not at all free and worse, results in them taking your phone number hostage for 2 years. They're straight-up liars. It's a disgrace. If they offer you ANYTHING ... especially a ""free phone"" ... run away as fast as you can.",1,25-Jan,3123
Xfinity #3123 Santa Cruz,Store Experience | Staff | Dissatisfaction,customer service beyond reprehensible. Employees don't care and cannot manage the simplest request. They were unable to even figure out how to utilize the data base. Gave me misinformation I promptly called and corrected with main number. This store is not worth your business nor your time. Interesting they claim ignorance about their jobs but underhandedly raised the price and added service I did not request. Beware they will misquote and raise your price. When questioned that they raised our price without permission for same exact service they lied . Called company 2x to get straightened out what they could not manage correctly.,1,25-Feb,3123
Xfinity #3123 Santa Cruz,Store Experience | Staff | Dissatisfaction,Have had a blinking phone for weeks and spoke with James today at Xfinity and he solved the blinking problem!! 3 other people there could not!! Hoorah for James!!,5,25-Mar,3123
Xfinity #3124 San Francisco,Store Experience | Customer Dissatisfaction,"The WORST Xfinity store ever. They WILL scam you. Got promised an Xfinity mobile plan for $25 a month. Didn't even use the service but they charged me $90. If you can help it, go somewhere else.",1,25-Mar,3124
Xfinity #3124 San Francisco,Store Experience | Long Wait Time,What time is two hours employees work extremely slow,1,25-Mar,3124
Xfinity #3124 San Francisco,Store Experience | Staff | Appreciation,"Friendly, professional service staff. Nicely organized displays of products and services.",5,25-Mar,3124
Xfinity #3124 San Francisco,Store Experience | Staff | Appreciation,The staff was friendly and helpful.,5,25-Mar,3124
Xfinity #3124 San Francisco,Store Experience | Staff | Behaviour Issues,"Refused to help me set up the service they sold me two weeks earlier 🙃
Completely unacceptable as well as inconsiderate and unkind. All the information that they sent me out to gather on my own or available on my phone plus one simple text no consideration for the fact that their company sold me the service and that I’m a senior trying to navigate their technology 🤨😤🤯",1,25-Feb,3124
