Store,smartIntent,message,starRating,Month of Fiscal Month,Blank
BP 59015 Woodinville,Store Experience | Customer Dissatisfaction,"This store sucks. I returned 3 pieces of equipment after canceling all services. I was never given a receipt. When I called Xfinity to verify equipment return they didn't have a record yet. Being only 24 hours after the return, I assume it takes a few days to update in the Xfinity corporate system. I drove to the store the next day to ask for a receipt and was told their printers ""sometimes print and sometimes not."" When they don't, an email confirmation of the return is sent in 24 hours. I told the customer service guy it's already past 24 hours. So I'm supposed to wait and see what happens. I went to the Kirkland store today to help my mom work her equipment return and they printed a physical receipt. This store sucks and I hope the manager sees this review. Garbage.",1,25-Feb,59015
BP 59015 Woodinville,Store Experience | Long Wait Time,Come on! 3 representatives and I have been standing here for 30 min trying to return equipment! People literally walking out because it’s taking forever.,1,25-Mar,59015
BP 59015 Woodinville,Store Experience | Staff | Dissatisfaction,People committing fraud work here. Veronica the customer service rep handled my mother in laws account and set up a new mobile line on my mother in laws account without her authorization. Veronica was even using the phone for a few days with calls and texts being made until I noticed it was my mother in laws account when I was helping her untangle the mess Veronica created for her. Terrible !! She should be fired!,1,25-Jan,59015
"BP #1339 South Elgin, IL",Store Experience | Customer Dissatisfaction,"Horrible customer service. I went in because Xfinity straight up stole money from me. I ordered Internet and they sent me 2 pieces of equipment so when the tech came out he said I didn't need both. I tried to get him to take it but he said keep it. I was charged three times for unused equipment. I called Xfinity and chatted with an agent on my phone, they didn't resolve the issue. Instead they tried to upsell me cell service. I got fed up and went to this store. Luis took the equipment back then explained that because Xfinity has a policy of 30 days for the unused equipment he couldn't refund me more than $15. I said that was unacceptable and wanted to talk to a manager. He said there was no manager and to come back tomorrow. I've already wasted hours on this issue. And it's complete bullshit that there was no manager there. But whatever. I'll be looking for another Internet provider so they'll be losing almost $100 in business. But my whole point is Xfinity does this on purpose. They mailed me extra equipment so that they could then charge me extra every month. It's a trash company and I think everyone should know that what they're doing is wrong. Not only wrong but I'm surprised people just take it because they know they're one of the best Internet companies out there. But here's another thing they have money yet they choose to outsource customer service to other countries. Stop giving them business",1,25-Jan,1339
"BP #1339 South Elgin, IL",Store Experience | Long Wait Time,Went to return my router and had to wait 30 minutes.  Why is that something I have to wait for?,1,25-Mar,1339
"BP #1339 South Elgin, IL",Store Experience | Staff | Dissatisfaction,Inept employees,1,25-Mar,1339
"BP #1737 Kentwood, MI",Store Experience | Staff | Appreciation,"Great service, appears to be a busy location so put your patient hat on but the staff are friendly and attentive",5,25-Mar,1737
"BP #1737 Kentwood, MI",Store Experience | Staff | Dissatisfaction,They have the worst Internet I’ve ever had after 9 PM. I have no Internet I’ve officially ordered by Starlink. Can’t wait to be done with this whole organization.,1,25-Mar,1737
BP #51000 Tamarac,Store Experience | Customer Dissatisfaction,"(Translated by Google) Well, I recommend this store in terms of customer service. On December 31, my line was cut off due to an error in the system at 4:30 p.m., I was left without any kind of communication (no calls, no texts), as I could, I connected to a Wi-Fi network and arrived at the store located at Sunrise where the advisors were super rude and were making fun of me in English (they thought I didn't understand), I asked them to lend me a phone so I could call 611 from Xfinity and they told me they weren't authorized… bottom line, no one helped me.” On the contrary, at this headquarters they were super friendly, the Dominican guy (I don't remember his name) lent me the phone and helped me solve everything I had to do on the phone in a very good way. Thank you so much.

Well, I recommend this store in terms of customer service. On December 31 they cut my line due to an error in the system at 16:30, I was left without any kind of communication (no calls, no texts), as I could I connected to a wifi network and I arrived at the store located in Sunrise where the advisors were super rude and were making fun of me in English (they thought I didn't understand), I asked them to lend me a phone to be able to call 611 from Xfinity and they told me that they were not authorized ... with conclusion no one helped me."" On the contrary in this headquarters they were super friendly, the Dominican boy (I don't remember the name) lent me the phone and helped me solve everything I had to do on the phone in a very good way. Thank you very much.

(Original)
Bueno, les recomiendo  este store en cuanto  servicio al cliente. El día 31 de diciembre me cortaron la línea por un error en el sistema a las 16:30, me quedé sin ninguna clase de comunicación (no llamadas, no textos), como pude me conecte a una red wifi y llegué al store localizado en Sunrise donde los asesores fueron súper groseros y se estaban burlando de mí en inglés (pensaron que no entendía), les pedí que me prestaran un teléfono para poder llamar a 611 de Xfinity y me dijeron que no estaban autorizados…conclusión nadie me ayudó”. Por el contrario en esta sede fueron súper amables, el chico dominicano (no recuerdo el nombre) me prestó el teléfono y me ayudó  a solucionar todo lo que tenía que hacer en el teléfono de una muy buena manera. Muchas gracias.

Well, I recommend this store in terms of customer service. On December 31 they cut my line due to an error in the system at 16:30, I was left without any kind of communication (no calls, no texts), as I could I connected to a wifi network and I arrived at the store located in Sunrise where the advisors were super rude and were making fun of me in English (they thought I didn't understand), I asked them to lend me a phone to be able to call 611 from Xfinity and they told me that they were not authorized ... with conclusion no one helped me."" On the contrary in this headquarters they were super friendly, the Dominican boy (I don't remember the name) lent me the phone and helped me solve everything I had to do on the phone in a very good way. Thank you very much.",5,25-Feb,51000
BP #51000 Tamarac,Store Experience | Customer Dissatisfaction,I arrived at 5:58 and they didn't want to serve me.,1,25-Feb,51000
BP #51000 Tamarac,Store Experience | Long Wait Time,"Horrible service, waited in the store for almost an hour just for the systems to stop working as soon as it was time for me to check out. Massive waste of time, spare yourself the disappointment and go to a real Xfinity store.",1,25-Jan,51000
BP #51000 Tamarac,Store Experience | Long Wait Time,"Parish was nice, and cute! lol despite the brief wait, he got me in and out’",5,25-Jan,51000
BP #51002 Coconut Creek,Store Experience | Customer Dissatisfaction,"Store is supposed to be open 9am Saturday. 9:10am and the store is not open and no employees are here. They wonder why they are losing customers. Management should be looked at, based on all the 1 star reviews.",1,25-Feb,51002
BP #51002 Coconut Creek,Store Experience | Long Wait Time,"It says 9am-8pm on the door and online. There’s no one here. People are waiting outside, photo taken at 9:12",1,25-Jan,51002
BP #51002 Coconut Creek,Store Experience | Staff | Appreciation,"I’ll keep this short & to the point. My family and I went to this location to purchase a cell phone for my son’s birthday gift. Didn’t have to wait long, Noel came to help. He was great- very attentive, knowledgeable, and patient. Great customer service!",5,25-Feb,51002
BP #51003 Lauderhill,Store Experience | Customer Dissatisfaction,"A rating of one star is undoubtedly excessive.
To begin, I must express my profound dissatisfaction with the customer service experience I encountered at this establishment. This is not an isolated incident, as I have previously sought assistance with various issues and was met with unhelpful responses and indifference. The representative’s attitude towards resolving my problem was clearly one of apathy.

It is unacceptable to treat paying customers as inconveniences. Customer service should be dedicated to providing assistance and support, not to exacerbating customer frustration. Consequently, I will not be returning to this establishment in the future.",1,25-Feb,51003
BP #51003 Lauderhill,Store Experience | Customer Dissatisfaction,Customer service here is horrible I walked in at 7:45pm no one greeted me or even asked me if I wanted help . A female worker walked to the back to hide rather than helping customers.,1,25-Feb,51003
BP #51003 Lauderhill,Store Experience | Staff | Behaviour Issues,"So I cancelled my basic cable and home phone and kept my internet over the phone with Alex on Friday. I asked a friend to return the box and remote to this location and pay my bill. Once he arrived Kim the ""sales rep"" told him she could lower my price for two years to $120.00 a month by keeping the home phone. Friday phone changes would be $115.00 per month. Kim took about two hours and had my friend to call me on the phone. Kim had trouble with making her proposal to go through. After about an hour my friend got frustrated a left with the receipts. Here's the weird part after he left "" Kim"" called me back and asked me for my SS# and DOB. When I refused to give it to her, she hung up in my face. I called back no answer.This girl is shady. Know I will be making a complaint. This location has scammers on board!!!",2,25-Feb,51003
BP #51004 Greenacres,Store Experience | Staff | Appreciation,"I want to commend the technicians who worked at my home today. They did an excellent job, demonstrating professionalism and efficiency. They came in, assessed the situation, and completed the work thoroughly and promptly. I truly appreciate their hard work and the quality of service provided. Thank you for hiring such skilled professionals!",5,25-Jan,51004
BP #51004 Greenacres,Store Experience | Staff | Dissatisfaction,I was treated absolutely terrible then they threatened to call the police on me because I was crying about my phone I was in the middle of closing a deal on a house and I run a business and you guys sold me a broken phone and I can't believe I was treated this way and I'm switching everything from Xfinity to another carrier I've been with you guys for a long time I own 15 different sober living houses and I will never ever ever do business with you guys again you lost a really good customer. It seems like you guys just will hire anybody I mean these kids are like 15 years old and they don't even know what they're talking about and they're so rude and have no customer service skills terrible and really bad for business.,1,25-Feb,51004
BP #51004 Greenacres,Store Experience | Staff | Dissatisfaction,"I would stay away from this store, the reps here have no integrity. They will lie to you, do yourself a favor and find another Xfinity even if this store is conveniently closer. No leadership.",1,25-Mar,51004
BP #51004 Greenacres,Store Experience | Staff | Dissatisfaction,"Put on hold for 4 0 minutes, each person you speak with gives a different answer to the same question, no one knows anything I'm Amazed.",1,25-Feb,51004
BP #51004 Greenacres,Store Experience | Staff | Dissatisfaction,"Rude, disrespectful kids working there.   Should all be fired.  I asked for help bringing in equipment to return.  One said I'm not going outside, the other said we don't do that and they all sat and grumbled they didn't want to help.   This is NOT customer service.  I asked for their names and one turned his back on me, the other rude one turned his name around and showed me a blank side while laughing and the other was Jerimiah.   Terrible way to treat any customer, especially a senior citizen that has had comcast for 25 years.   Going to Hotwire now.",1,25-Mar,51004
BP #51004 Greenacres,Store Experience | Staff | Manager Complaints,"(Translated by Google) The worst experience of my life, the representative who is assisting me, Rayan, left the counter for more than 20 minutes and when I asked the next representative, Anthony, if I could call him, he told me I don't have to do anything for him, I am assisting him. this lady and nothing more, the lady told him that you are a rude person, look for your manager and he answered that there is no manager there, another boy came and told me what happened and I told him I entered the door where Rayan was and he told me that now there is your phone that is already You can go, the phone needed 40 minutes to finish transferring the data, anyway I'm at home and without a phone because something happened that doesn't work, I called Xfinity customer services Manuel apparently didn't know what he was doing and Daniela never knew how to help me find out how to fill out a written complaint

(Original)
La peor experiencia de mi vida el representante que me está atendiendo Rayan se fue de el mostrador mas de 20 minutos y cuando le pedí al siguiente representante Anthony que si lo podía llamar me dijo yo no tengo que hacer nada para el, yo estoy atendiendo a esta señora y nada más, la señora le dijo usted es un grocero, busque a su manager y le contestó que allí no hay manager, vino otro muchacho y me dijo que pasó y le dije entro a puerta donde estaba Rayan y me dice que ya está su teléfono que ya se puede ir, el teléfono le faltaba 40 minutos para terminar ese pasar los datos en fin estoy en mi casa y sin teléfono pues algo pasó que no funciona, llamé a Xfinity customer services Manuel aparentemente no sabía lo que hacía y Daniela nunca supo cómo ayudarme a encontrar cómo llenar una queja escrita",1,25-Jan,51004
BP #51005 Royal Palm Beach,Store Experience | Customer Dissatisfaction,"They have like seven employees in they're sitting around doing nothing;  I'm called right away, but the young man was not very helpful. He acted like I was a burden. Xfinity has my information saved incorrectly and so every time I give my cell phone number it says that number isn't registered to an account: EVEN THOUGH xfinity IS MY MOBILE PROVIDER.
Anyway, he acted annoyed about helping me log into the Wi-Fi at the store so that I could physically log into my account and show him what I was talking about.
I left more confused than when I went in there, I understand being 18 but I don't understand not having any experience in customer service whatsoever and playing with your hair the entire time you're talking to me.",1,25-Mar,51005
BP #51006 Sunrise,Store Experience | Customer Dissatisfaction,"(Translated by Google) Well, I tell you that this Xfinity store is the worst in customer service. On December 31, my line was cut off due to an error in the system at 4:30 p.m., I was left without any kind of communication (no calls, no texts), as I could, I connected to a Wi-Fi network and got there to ask that Please help me. When I arrived the advisors were super rude and were making fun of me in English (they thought I didn't understand), I asked them to lend me a phone so I could call 611 from Xfinity and they told me that they were not authorized...conclusion no one helped me and I had I had to go “illogically to the AT&T store so they could lend me a phone so I could call Xfinity customer service” 😡.

Well, I tell you that this Xfinity store is the worst in customer service. On December 31, my line was cut off due to an error in the system at 16:30, I was without any kind of communication (no calls, no texts), as I could I connected to a wifi network and I got there to ask them to please help me. When I arrived the advisors were super rude and were making fun of me in English (they thought I didn't understand), I asked them to lend me a phone so I could call 611 from Xfinity and they told me that they were not authorized ... conclusion no one helped me and I had to go ""illogically to the at&t store cross street so that they could lend me a phone and be able to call Xfinity customer service"" 😡.

(Original)
Bueno, les cuento que este store de Xfinity es el peor en servicio al cliente. El día 31 de diciembre me cortaron la línea por un error en el sistema a las 16:30, me quedé sin ninguna clase de comunicación (no llamadas, no textos), como pude me conecte a una red wifi y llegué allí a pedir que por favor me ayudaran. Cuando llegué los asesores fueron súper groseros y se estaban burlando de mí en inglés (pensaron que no entendía), les pedí que me prestaran un teléfono para poder llamar a 611 de Xfinity y me dijeron que no estaban autorizados…conclusión nadie me ayudó y tuve que ir “ilógicamente al store de at&t para que me prestaran un teléfono y poder llamar a servicio al cliente de Xfinity” 😡.

Well, I tell you that this Xfinity store is the worst in customer service. On December 31, my line was cut off due to an error in the system at 16:30, I was without any kind of communication (no calls, no texts), as I could I connected to a wifi network and I got there to ask them to please help me. When I arrived the advisors were super rude and were making fun of me in English (they thought I didn't understand), I asked them to lend me a phone so I could call 611 from Xfinity and they told me that they were not authorized... conclusion no one helped me and I had to go ""illogically to the at&t store cross street so that they could lend me a phone and be able to call Xfinity customer service"" 😡.",1,25-Feb,51006
BP #51006 Sunrise,Store Experience | Staff | Appreciation,Shepherd was very helpful and personable with my billing concerns. He provided excellent customer service which was much appreciated,5,25-Feb,51006
BP #51006 Sunrise,Store Experience | Staff | Behaviour Issues,"I had a disappointing experience at this Xfinity store due to the unprofessional attitude of one of the employees.
Instead of providing helpful service, he responded with unnecessary sarcasm when I explained my issue.

I came in because my chip wasn’t connected—I already knew that, which is why I sought help. His unnecessary comment was uncalled for. While he used polite words, his attitude made it clear that he didn’t mean them.

A little professionalism and courtesy would go a long way.",2,25-Feb,51006
BP #51007 St. Johns,Store Experience | Customer Appreciation,I highly recommend this store. The Manager Patrick helped me out a lot with my  purchase. He really knew what he was talking about.,5,25-Mar,51007
BP #51007 St. Johns,Store Experience | Staff | Appreciation,"Everything was done so quick thanks to Robert, one of the employees here. I expected to spend an hour or two out of my day to get my wifi situation figured out but everything was done in 20 minutes or less!",5,25-Mar,51007
BP #51007 St. Johns,Store Experience | Staff | Appreciation,"I had an exceptional experience! The staff was incredibly friendly and knowledgeable, helping me with everything I needed from setting up my new devices to answering all of my questions about the services. 10/10",5,25-Mar,51007
BP #51007 St. Johns,Store Experience | Staff | Appreciation,"I have visited this place many times for my internet and cell phone service, and they are always incredibly helpful. Today, I spoke with Dalton, who was friendly, patient, and went out of his way to find the best options for me. Great service as always!",5,25-Jan,51007
BP #51007 St. Johns,Store Experience | Staff | Appreciation,Robert was great. Gonna come back here soon,5,25-Mar,51007
BP #51007 St. Johns,Store Experience | Staff | Appreciation,"Such amazing service from Robert, will definitely get phones here",5,25-Mar,51007
BP #51007 St. Johns,Store Experience | Staff | Appreciation,"Thank god Robert stepped in and helped out, he gets 5 stars and my business from now on, very competent and knowledgeable",5,25-Mar,51007
BP #51007 St. Johns,Store Experience | Staff | Appreciation,They provided excellent customer service,5,25-Mar,51007
BP #51007 St. Johns,Store Experience | Staff | Appreciation,Very helpful,5,25-Feb,51007
BP #51007 St. Johns,Store Experience | Staff | Appreciation,Went to this Xfinity the other day and had great customer service with Robert!,5,25-Mar,51007
BP #51007 St. Johns,Store Experience | Staff | Behaviour Issues,"The worst customer service ever the guy on the phone was so rude. And at the end of the call when I said, I’m gonna think about it and I’m gonna call back,  he was like is this a joke and hang up on me . Even  if I was thinking to go with Xfinity now I’m not",1,25-Mar,51007
BP #51007 St. Johns,Store Experience | Staff | Dissatisfaction,"I went to Xfinity a couple days or so ago hoping to get some help with an ongoing issue I had been having with their service. The lady who was supposed to be “helping” me, her name was Naomi, seemed to have no idea what she was doing in the slightest. I’m unsure if she was a newer employee, but it was incredibly excessive and ridiculous. I stood in this store for hours getting more and more frustrated because I had things to do and I didn’t have time to be standing in Xfinity all day. It seemed like every 3 minutes she was asking the other employees of the store what to do or how to fix something. I came to Xfinity to get help with something I did not know how to fix on my own, but it’s very discouraging when the employee that helps me seems to know less about their own job, company, and issues than I do. I think I could’ve fixed this issue faster than she did with absolutely no knowledge on this stuff. Complete waste of time.",1,25-Mar,51007
BP #51009 Oak Ridge,Store Experience | Customer Dissatisfaction,Just returned all of my equipment and canceled my Comcast service. I was able to get $50 off at at&t. The brick and mortar store in Oak Ridge has been one of the worst experiences during my last 12 years with Comcast. It was worse than being on the phone with their customer service. There were about six or seven employees and only four were helping customers. My favorite was the guy with the big bushy beard who kept walking out from the back room and would just stare and then continue to walk around at a turtle pace and not really help anybody. He was working really hard to not work. Oh well I no longer have to worry because I will not be a returning customer for Comcast (Xfinity).,1,25-Jan,51009
BP #51009 Oak Ridge,Store Experience | Long Wait Time,"Lindsay was awesome!
Very busy, but she was efficient and knowledgeable and made everything easy and quick.",5,25-Feb,51009
BP #51009 Oak Ridge,Store Experience | Long Wait Time,"Store doesn’t have enough employees to serve customers in a timely fashion.  Expect a line and long waits, typically over 30 minutes!

Yes I know xfinity offers call in service but it can take an hour or more on the phone (not including waiting for call backs) to get things handled.  The service in the store is better but there are long waits for this service too!",3,25-Jan,51009
BP #51009 Oak Ridge,Store Experience | Long Wait Time,"This place reminded me of the DMV, the line was to the door. I went the next day as soon as they opened and even then folks were waiting in the parking lot. I was still able to walk straight to the counter. So just a friendly heads up.",3,25-Feb,51009
BP #51009 Oak Ridge,Store Experience | Staff | Appreciation,"Lyndsea was awesome she saved me money,kept my plan and upgraded me.Kudos to Lyndsea",5,25-Feb,51009
BP #51009 Oak Ridge,Store Experience | Staff | Behaviour Issues,"Went into the store did the special for the upgrade and the representative did not return my phone which is thief and now I am being charged for the remainder of the old phone. Do not trust this company. When upgrading your old phone ask them for the mailing packet as they are not supposed to keep your phone. Wish I would’ve known that whenever I traded in my old phone, which was not even a year old now I’m now stuck paying for a phone that they stole because I was told by the rude boy that they mail them in. I am not happy at all filling a police report tomorrow.",1,25-Feb,51009
BP #51009 Oak Ridge,Store Experience | Staff | Dissatisfaction,Guys at store were zero help….they had no answers for questions I had…plus were very busy playing on their phone!,1,25-Jan,51009
BP #51011 Greeneville,Store Experience | Customer Dissatisfaction,"When you wanna talk to the people in the store and they put you to a customer service people phone number is ridiculous. If anyone from the store, please contact me.",1,25-Mar,51011
BP #51011 Greeneville,Store Experience | Staff | Appreciation,"Jameison, thank you!!!  I really really really appreciated him. I have been thru stress but this tops it all! After 30+ agents he is the main person to get me to the finish line in saving my phone number associated with many clients. His patience is a virtue and he vibe will keep you calm during extreme high stress situations. Ask for him by name Jameison!!! Ur the best!!!!",5,25-Mar,51011
