Xfinity #1513 Ft. Myers,Store Experience | Staff | Appreciation,"(Translated by Google) Very friendly and professional staff. Very good service and there is a representative who spoke Spanish quite well.

(Original)
Muy amable y profesional el personal. Muy buena atención y hay un representante que hablabas bastante bien el  español",5,25-Feb,1513
Xfinity #1513 Ft. Myers,Store Experience | Staff | Appreciation,"Great help, fast service, I really appreciate it!",5,25-Jan,1513
Xfinity #1513 Ft. Myers,Store Experience | Staff | Appreciation,Great service and understanding of my problem,5,25-Jan,1513
Xfinity #1513 Ft. Myers,Store Experience | Staff | Appreciation,No appointment necessary.  Fairly quick in and out. Great staff,5,25-Feb,1513
Xfinity #1513 Ft. Myers,Store Experience | Staff | Appreciation,People are nice  service are awesome,5,25-Mar,1513
Xfinity #1513 Ft. Myers,Store Experience | Staff | Appreciation,The gentleman that helped us was very professional and timely,4,25-Jan,1513
Xfinity #1513 Ft. Myers,Store Experience | Staff | Behaviour Issues,Ridiculous 0 stars rude employees,1,25-Jan,1513
Xfinity #1513 Ft. Myers,Store Experience | Staff | Behaviour Issues,"Terrible Customer Service Experience!

I had a very disappointing experience with Niko at Xfinity Comcast in Fort Myers. His customer service was unprofessional, and he treated me with a complete lack of respect. Instead of being helpful, he was rude and dismissive, making the entire process frustrating and unpleasant.

I do not recommend dealing with him at all. Xfinity should hire more qualified professionals who know how to treat customers properly. A company of this",1,25-Mar,1513
Xfinity #1513 Ft. Myers,Store Experience | Staff | Dissatisfaction,"If you come in speaking Spanish, one of the people in front of you will receive a different customer service tone in which they speak to you than if you come in speaking English. I didn't like the welcome at all.",1,25-Feb,1513
Xfinity #1513 Ft. Myers,Store Experience | Staff | Dissatisfaction,"You have to essentially pull teeth to talk to a live agent to get your questions answered. You call the number and it immediately pushes you to an AI assistant who has automated answers via text. When you ask for a live agent, you keep being pushed to talk to the AI assistant. You have to really push to chat with someone to actually get the help you need! It's very frustrating.",1,25-Feb,1513
Xfinity #1514 Pembroke Pines,Store Experience | Customer Appreciation,My experience has been excellent the multiple times I’ve been here.,5,25-Mar,1514
Xfinity #1514 Pembroke Pines,Store Experience | Long Wait Time,30 plus wait time at 3pm during the week to return equ,3,25-Mar,1514
Xfinity #1514 Pembroke Pines,Store Experience | Long Wait Time,"(Translated by Google) 40 minute wait

(Original)
40 minutos de espera",1,25-Feb,1514
Xfinity #1514 Pembroke Pines,Store Experience | Long Wait Time,"(Translated by Google) Too much waiting time

(Original)
Demasiado la hora de espera",1,25-Mar,1514
Xfinity #1514 Pembroke Pines,Store Experience | Long Wait Time,Bad Management too much wait time.,1,25-Jan,1514
Xfinity #1514 Pembroke Pines,Store Experience | Long Wait Time,"The long wait for the simplest issue, the CR are not the nicest",3,25-Jan,1514
Xfinity #1514 Pembroke Pines,Store Experience | Staff | Appreciation,"(Translated by Google) Excellent service and attention!!

(Original)
Excelente servicio y atención!!",5,25-Feb,1514
Xfinity #1514 Pembroke Pines,Store Experience | Staff | Appreciation,Staff has so much great information to solve all of my internet & TV services.,5,25-Mar,1514
Xfinity #1515 Ft. Lauderdale,Store Experience | Customer Dissatisfaction,complete incompetence. I opened a new account. for some reason they opened 2 by mistake. One was at an address thaty never had there service.  I spent 2 hours in the office trying to fix it.  To no avail,1,25-Feb,1515
Xfinity #1515 Ft. Lauderdale,Store Experience | Long Wait Time,Had a device from xfinity I needed to return. Refused to process return said I needed to call xfinity and return by mail. lol why does this store even exist. What a waste of my time. Also there were practically no customers in the store and they told me I needed to give them my phone number and wait to talk to someone. Even though there were no customers I still was told to wait.,1,25-Feb,1515
Xfinity #1515 Ft. Lauderdale,Store Experience | Long Wait Time,The incompetence of the employees is pathetic. I waited for a hour to return all of the equipment. I could not handle being told to sit down and wait your turn with no ideas how much more than an hour do these employees need with each customer. All of the same customers being served were still there after a whole hour with no updates about the waiting times.,1,25-Mar,1515
Xfinity #1515 Ft. Lauderdale,Store Experience | Short Wait Time,Quick to meet n quick to resolve why I was  there,5,25-Jan,1515
Xfinity #1515 Ft. Lauderdale,Store Experience | Staff | Appreciation,Good service,4,25-Mar,1515
Xfinity #1515 Ft. Lauderdale,Store Experience | Staff | Appreciation,Great customer service 👏,5,25-Feb,1515
Xfinity #1515 Ft. Lauderdale,Store Experience | Staff | Appreciation,Great experience!! Great job! Especially about Jordan for amazing job!! The chat service as well.. I  recommend!,5,25-Feb,1515
Xfinity #1515 Ft. Lauderdale,Store Experience | Staff | Appreciation,"I had a fantastic experience with Xfinity, thanks to Shona who went above and beyond to assist me.",5,25-Mar,1515
Xfinity #1515 Ft. Lauderdale,Store Experience | Staff | Appreciation,"Nidia was a great person  , and I took care of myself .",4,25-Jan,1515
Xfinity #1515 Ft. Lauderdale,Store Experience | Staff | Appreciation,"The young lady who helped me with my questions was very professional and attentive -- answered my questions -- I was in the area & happy stopped @ this store
even though far from my house--",5,25-Mar,1515
Xfinity #1515 Ft. Lauderdale,Store Experience | Staff | Manager Complaints,"I had decided to maybe save some money and turn in my equipment and start streaming The back TV did fine with the fire stick because it wasn't a smart TV The front TV not so much. I went into the store after talking to people on the phone because I was told three different things from three different people they really need to have a big meeting and put everybody on the same page. Anyhow, I went into the store and I asked the lady when they take your name for the way to please let me speak to somebody who is a manager for my issue. Of course when I'm in my name did get called I did not get a managerial position person I got a young woman. I asked her about my streaming and if there's something I could do about it or what my options were and her answering me was I don't know. Well that doesn't answer my questions cuz well I don't know. So then I had to ask for a manager. A manager did come I asked him a couple questions he was very short very abrupt and obviously acting like he didn't have time for me or my questions. I have been an Xfinity customer for over 20 years and I've been in the store a few times there was a manager that was there all the time that was wonderful did not see him and I'm not there that often but I did not recognize any of the people and usually I see the same people. I don't know what's going on with their customer service it was awful and if I had other options at the moment to to go to another provider I would at this moment I don't so just saying awful awful customer service and I am looking for another provider as we speak",1,25-Jan,1515
Xfinity #1516 St. Augustine,Store Experience | Customer Dissatisfaction,"I begrudgingly traveled 50 miles to this store and really expected a struggle.  To my surprise, I was in and out the door in less then ten minutes. Problem-solving was their specialty last Sunday. They exceeded my expectations.",5,25-Mar,1516
Xfinity #1516 St. Augustine,Store Experience | Long Wait Time,"Busy, long wait, informative, professional, friendly",4,25-Mar,1516
Xfinity #1516 St. Augustine,Store Experience | Staff | Appreciation,It was great wonderful service and nice people,5,25-Feb,1516
Xfinity #1516 St. Augustine,Store Experience | Staff | Appreciation,"STORE EMPLOYEE VENO IS THE BEST, BY FAR!!! HE IS SO KNOWLEDGEABLE, PATIENT, TRUSTING, AND JUST AN ALL-AROUND GREAT GUY!!!HE IS SUCH AN IMPORTANT ASSET TO THE XFINITY FAMILY HERE IN ST. AUGUSTINE. FLORIDA!!!!!🤩",5,25-Jan,1516
Xfinity #1516 St. Augustine,Store Experience | Staff | Appreciation,"Very helpful staff, took care of all my issues and questions",5,25-Jan,1516
Xfinity #1517 Tallahassee,Store Experience | Customer Appreciation,"So after a year of service in the southeast side of leon county has been ok but the 1 star is for when the power goes out so does internet service so using a generator or even spending  $ on battery backup systems like the ones they promote are useless..
Now in store service has been great for only 2 visits. I did get an xfinity account fraud tho from overseas saying my account promotion was up and to pay $300  now. But called xfinity and they said it was fraud but how did they know that my promotion was expiring? Or my contact info? They sell so much info it should be invasion of privacy.",1,25-Mar,1517
Xfinity #1517 Tallahassee,Store Experience | Long Wait Time,Had to return a box. Walked in they immediately waited on me. In and out in 5 mins.,5,25-Mar,1517
Xfinity #1517 Tallahassee,Store Experience | Long Wait Time,I had a really good experience at Xfinity the other day. I walked in and it was packed. But someone helped me quick. I upgraded to 1300 and it’s been great so far. Ps. Make sure you make an appt. You can save a lot of time. And everyone was pretty helpful,5,25-Mar,1517
Xfinity #1517 Tallahassee,Store Experience | Long Wait Time,"It was a long wait, but I knew it would be since it was the holidays, so I didn’t mind! Patience is a virtue",4,25-Jan,1517
Xfinity #1517 Tallahassee,Store Experience | Long Wait Time,"Not very many other options to get service, these poor tech support perform well and courteous stand all day assisting many customers in a row. Hard for me to make an appointment but you will still wait 45 minutes to an hour to be assisted even with an appointment.",2,25-Jan,1517
Xfinity #1517 Tallahassee,Store Experience | Long Wait Time,"Very, very busy. Had to wait about 45 minutes. Great service. Let's see if they come through on their promises. Beautiful store. Close to Blaze Pizza and Nothing Bundt Cakes if you're there around lunch time.",4,25-Feb,1517
Xfinity #1517 Tallahassee,Store Experience | Staff | Appreciation,My experience with Keith was fantastic!!! 10/10. I’m keeping the service because of him,5,25-Jan,1517
Xfinity #1517 Tallahassee,Store Experience | Staff | Dissatisfaction,Costs too much for a service we never receive and it's nearly impossible to get a person on the phone our out to the house to check the service. They say they'll follow up and don't. Poor customer service.,2,25-Mar,1517
Xfinity #1517 Tallahassee,Store Experience | Staff | Manager Complaints,"My elderly parents have been to the Magnolia Dr  storefront twice, the first time a young saleswoman mocked them and sent them away, today a woman named Ariel McKinney gave them a business card with two fake numbers. There is no way to speak to the manager on the phone and, of course, the customer service line is long convoluted and does not let you speak to an agent. The customer service for this company is unbelievably bad.",1,25-Feb,1517
Xfinity #1518 Delray Beach,Store Experience | Customer Dissatisfaction,"A 45 minute wait to handle a 2 minute transaction is astronomical. They add everyone to the same waitlist regardless of the transaction being performed.

Operationally they should waitlist customers based on the transaction being performed. The greeter at the door can probably handle majority of customers questions without waitlisting them to see an agent.

One customer waited 35 minutes to just be told they have to call customer care. This store lacks sense of urgency. There was a lady that appeared to be a supervisor that can handle a lot more than what she was doing.",1,25-Jan,1518
Xfinity #1518 Delray Beach,Store Experience | Customer Dissatisfaction,"This store charged us when we didn’t even get what we had looked at. Then, they set up a monthly charge for the service for the item we didn’t get and processed it. Don’t understand how this is possible but they made it happen. We had to wait a half hour to speak to someone as well. Really disappointing. I see they do t have good reviews and now I know why. AVOID THIS LOCATION. You are just a number here. 👎👎",1,25-Feb,1518
Xfinity #1518 Delray Beach,Store Experience | Staff | Appreciation,Great group of people. Very helpful and knowledgeable.,5,25-Mar,1518
Xfinity #1519 Venice,Store Experience | Long Wait Time,"I canceled because my bill slowly went from 80 bucks and crept way all the way to $120 for no apparent reason at all then when I canceled and went to return their equipment, they demanded to have back I was told I had to wait in a line of eight people before they could take their equipment that they wanted from me backwould not recommend",1,25-Jan,1519
Xfinity #1519 Venice,Store Experience | Long Wait Time,Long wait just to return equipment confirms my decision to switch to Frontier,1,25-Feb,1519
Xfinity #1519 Venice,Store Experience | Not Recommended,"Can’t get live tv on my main tv for three days, called up to complain, got no satisfaction. If your thinks about using this company I would think twice. Can’t get an appointment at the store for 10 days. I can watch my shows after they are recorded but not live. Bring a translation book if you have to speak to a representative.",1,25-Feb,1519
Xfinity #1519 Venice,Store Experience | Not Recommended,"Comcast kept breaching the contract by adding additional services to my account and I had to call every month to take it off. By the time I got tired of it and canceled, Comcast charged me $200 for canceling the contract. I opened a case to resolve the problem, ticket was closed 15 min later. After me spending 2 HOURS ON CHAT with two different people explaining the whole situation.
I got sick of all that, paid my balance. Got a text this morning I am sent to collections!!!! Shame on you Comcast. Never will I ever recommend you to anyone!!!!",1,25-Feb,1519
Xfinity #1519 Venice,Store Experience | Staff | Appreciation,Eric was very professional and positive during a frustrating and stressful situation. He went above and beyond to assist me and my family and we ended up having a great experience today.,5,25-Mar,1519
Xfinity #1519 Venice,Store Experience | Staff | Dissatisfaction,Had a problem with wi-fi which could only be solved by phone calls to a special number. No real “in store” solution with two people working on it. I waited an hour twice and only got more frustrated with only a phone number to call.,4,25-Feb,1519
Xfinity #1520 Cape Coral,Store Experience | Customer Appreciation,Easy breezy exchanged a box right outside very convenient!,5,25-Mar,1520
Xfinity #1520 Cape Coral,Store Experience | Customer Dissatisfaction,Worst service ever go to quantum instead they raised my bill I closed it return their box and the following month took money out of my account refused to refund it and customer service hung up on me rude I hate them now I have to call my bank to put a stop and block them and pay $30 chase sucks too evil world we live in money hungry,1,25-Jan,1520
Xfinity #1520 Cape Coral,Store Experience | Long Wait Time,"This  place is always busy , busy , busy. But they have great employees.",5,25-Mar,1520
Xfinity #1520 Cape Coral,Store Experience | Long Wait Time,Very busy. Decent support,4,25-Mar,1520
Xfinity #1520 Cape Coral,Store Experience | Staff | Appreciation,"(Translated by Google) Edis speaks Spanish very well and is very attentive and helpful. He explained the internet plans and benefits of XFINITY very well.

(Original)
Edis habla muy bien español y es bien atento y servicial. Explico muy bien los planes de internet y los beneficios de XFINITY",5,25-Feb,1520
Xfinity #1520 Cape Coral,Store Experience | Staff | Appreciation,"(Translated by Google) Excellent and precise attention

(Original)
Excelente y precisa atención",5,25-Feb,1520
Xfinity #1520 Cape Coral,Store Experience | Staff | Appreciation,Anika was wonderful in assisting with a complex issue I had for a few days. She took care of it immediately and was very professional and courteous.,5,25-Feb,1520
Xfinity #1520 Cape Coral,Store Experience | Staff | Appreciation,Fast and friendly,5,25-Mar,1520
Xfinity #1520 Cape Coral,Store Experience | Staff | Appreciation,Jase got me all set and handled all the hard work! He was GREAT!!!Thank you for getting me into my new iphone!,5,25-Mar,1520
Xfinity #1521 Miami,Store Experience | Customer Appreciation,"(Translated by Google) Excellent I will go again and the service is good

(Original)
Exelente volveré a ir y la atención buena",5,25-Jan,1521
Xfinity #1521 Miami,Store Experience | Customer Appreciation,XFINITY should add MORE LOCATIONS in Coral Gables or  Brickell or Miami Shores ... Just more locations in MIAMI 🙏,5,25-Jan,1521
Xfinity #1521 Miami,Store Experience | Customer Dissatisfaction,"(Translated by Google) Tremendous attention, I have no complaints, without a doubt all my doubts were clarified and I left very pleased.

(Original)
Tremenda atención no tengo quejas sin duda esclarecí todas mis dudas y salí muy complacido",5,25-Mar,1521
Xfinity #1521 Miami,Store Experience | Customer Dissatisfaction,"Worse place ever , the manager said you need a rental agreement in your house to have service in the address because the person who lived before has a balance. He also said the owner of property it’s evading taxes if you are paying without contract and it’s  not legal. So if you are in friend house for short time he needs to sign a contract otherwise you are not allowed to have this company. That’s why people are moving to AT&T. It’s none of your business if she is paying without  contract or not. Your job as a salaried worker is bring a good service and you talked to her so rude Chavista Democrat.",1,25-Feb,1521
Xfinity #1521 Miami,Store Experience | Long Wait Time,"After waiting an hour or so for Xfinity to call me back so I could cancel my internet service (can’t cancel online of course, that’d be too easy), I then waited nearly an hour in the store just to simply drop off their router. To top it off, the employee I had to wait and speak with before I could drop off the router had the audacity to lecture me about canceling my service (after my monthly cost tripled post-expiration of a sign up promotion), rather than just asking them for another promotion (which supposedly they would’ve given me had I asked, though of course they never said how much of a promotion and for how long). It seems Xfinity’s business strategy is to lure customers in with short-lived promotional pricing, then triple the price of their service after they’ve hopefully forgotten about it, but offer those select customers who do complain another short-lived promotion to try and keep them locked-in. That’s more akin to the way a drug dealer behaves than a good business. Even if there weren’t significantly cheaper and better options available, I’d never use Xfinity again on principle alone. But luckily it’s 2025 so there’s plenty of competition. Can’t wait to tap dance on the grave of this business when it finally goes bankrupt in another 10-20 years.",1,25-Jan,1521
Xfinity #1521 Miami,Store Experience | Staff | Appreciation,"(Translated by Google) Great service. Thanks to Jorge, the technician who helped me.

(Original)
Super atención. Gracias a Jorge el tecnico que me asistio",5,25-Feb,1521
Xfinity #1521 Miami,Store Experience | Staff | Appreciation,"(Translated by Google) Very good service satisfied with the very good service 👍

(Original)
Muy buen servicio satisfecho por el muy buen servicio 👍",5,25-Jan,1521
Xfinity #1521 Miami,Store Experience | Staff | Appreciation,"(Translated by Google) Very good service, they should increase the technical staff

(Original)
Muy buen servicio, deben aumentar el personal tecnico",4,25-Feb,1521
Xfinity #1521 Miami,Store Experience | Staff | Behaviour Issues,"(Translated by Google) Totally incompetent, the manager, a rude and very bad person, makes fun of people.

(Original)
Totalmente incompetente la encargada una maleducada y muy mala persona se burla de la gente",1,25-Jan,1521
Xfinity #1522 Lady Lake,Store Experience | Customer Dissatisfaction,"Not against this specific store per se, probably more of a broad Xfinity problem, but I drove 1.5 hours to this store for something simple that they “couldn’t resolve”. Also, all of their call centers are overseas and are misinformed. Very disappointed and dissatisfied!",1,25-Feb,1522
Xfinity #1522 Lady Lake,Store Experience | Long Wait Time,Horrible customer service. Waited over a Hour to RETURN EQUIPMENT!!! No way to add my name to a waiting list. I had to wait in line just to find out that I needed to wait in another Line. Don't use Comcast/Xfinity,1,25-Jan,1522
Xfinity #1522 Lady Lake,Store Experience | Long Wait Time,"It was only about a 10 minute wait. The young lady that helped me was very helpful. I was done in less than 10 minutes returning some equipment, and checking on my account.",5,25-Feb,1522
Xfinity #1522 Lady Lake,Store Experience | Long Wait Time,"Xfinity monopolizes many areas, by doing so it forces residents to be held hostage to get internet or cable .
During my recent visit I waited over an hour , just to turn in equipment and speak to a rep about billing issues.  It astounds me that there is so many issues everyone is having with them and they are still in business ONLY because they monopolize areas.
Customer service is horrible and almost non existent over the phone as their tech support and customer service is subbed out to some  third world country who can not speak English. I can stress enough the poor quality that xfinity provides !!!",1,25-Feb,1522
Xfinity #1522 Lady Lake,Store Experience | Short Wait Time,Quick and easy swap out of faulty equipment for new one. Didn't have to wait long.,5,25-Mar,1522
Xfinity #1522 Lady Lake,Store Experience | Staff | Appreciation,The staff were friendly and helpful. They were quick to offer assistance. The place itself is clean and well organized.,5,25-Jan,1522
Xfinity #1522 Lady Lake,Store Experience | Staff | Behaviour Issues,Fabulous help for this 84 year old lady that 3 other places wouldn’t take the time to help. Thank you Bill kaed. You should be employee of the year!,5,25-Mar,1522
Xfinity #1523 Estero,Store Experience | Customer Dissatisfaction,Slowest place I've ever seen. I was there for 45 minutes and they only called 2 customers. I left a and will never go back,1,25-Jan,1523
Xfinity #1523 Estero,Store Experience | Customer Dissatisfaction,"This place is horrible, worse than the drivers license branch. 6 workstations 2 people working. And they don’t seem to care. If there were an alternative they would not be in business. And you can’t talk to anyone on the phone. New low standard for customer service. Coconut point store, Estero",1,25-Mar,1523
Xfinity #1523 Estero,Store Experience | Staff | Appreciation,Adam and Jaiden were super helpful in resolving my problem. Thanks!,5,25-Mar,1523
Xfinity #1523 Estero,Store Experience | Staff | Appreciation,Excellent visit today at the Xfinity store.  Josue was extremely helpful with everything I needed.  Thank you for a great experience.,5,25-Jan,1523
Xfinity #1523 Estero,Store Experience | Staff | Appreciation,Great customer service!  Ask for Jaiden!,5,25-Mar,1523
Xfinity #1523 Estero,Store Experience | Staff | Appreciation,Had to return equipment very friendly young man scanned and gave me my receipt all good and a have a great day was exchanged,4,25-Feb,1523
Xfinity #1523 Estero,Store Experience | Staff | Appreciation,Jaiden gives wonderful customer service. Very knowledgeable and personable. I would recommend anyone having Xfinity issues to come see him!,5,25-Feb,1523
Xfinity #1524 Aventura,Store Experience | Customer Dissatisfaction,Great experience made a appointment for 3:30 I arrived 40 minutes early to return equipment I was out of there in less than 15 minutes,5,25-Mar,1524
Xfinity #1524 Aventura,Store Experience | Customer Dissatisfaction,Headquarters doesn't sync with the store. Wasted trips that turned into 3 visits instead of one.,2,25-Feb,1524
Xfinity #1524 Aventura,Store Experience | Long Wait Time,"(Translated by Google) Terrible service, the waiting times are very long and the store is full of employees and they do not give a reasonable reason, they are rude and not friendly, they should change them all

(Original)
Pésimo servicio, los tiempos de espera son muy largos y la tienda está llena de empleados y no dan una razón razonable, son rudos e nada amigables, deberían cambiarlos a todos",1,25-Mar,1524
Xfinity #1524 Aventura,Store Experience | Long Wait Time,Long wait time not enough workers,1,25-Jan,1524
Xfinity #1524 Aventura,Store Experience | Long Wait Time,"Pretty store but too long of a wait just to drop off equipment. I'm there first thing in the morning to drop off stuff that didn't even belong to me. I had no account: I was just ""doing the right thing"" and I had to wait almost 20 minutes just to say ""I don't have an account with you, but here's some stuff I found"". I did get to keep the Wi-Fi extender thingys, so that was cool.",4,25-Feb,1524
