BP #59048 Fremont,Store Experience | Not Recommended,Definitely not recommended. Waited for more than one hour. And they served someone come after me. They could not solve my issue even though I asked right away when I got into the store. Soooo frustrated,1,25-Feb,59048
BP #59048 Fremont,Store Experience | Staff | Appreciation,"Soroya did helped me during my visit here.
She patiently wait for my phone upgrade,
making sure every file was transferred to the new phone and checked if it’s working,
and make sure that files from the old phone was deleted. She had 3 customers at the same time, talk about multitasking. Grateful for her service and cheerfulness the whole time.",5,25-Mar,59048
BP #59048 Fremont,Store Experience | Staff | Behaviour Issues,"I had a very disappointing experience with a staff member, Chris. He was extremely rude and even started shouting, which made the situation unnecessarily stressful. As a customer, I expect to be treated with respect and professionalism, but unfortunately, that was not the case. Such behavior is unacceptable in a professional setting, and I hope management takes appropriate action to ensure better customer service in the future.",1,25-Mar,59048
BP #59049 Vancouver,Store Experience | Staff | Appreciation,Friendly staff,5,25-Mar,59049
BP #59049 Vancouver,Store Experience | Staff | Appreciation,"I had to change my review due to the customer service online. Tyler has nothing to do with this. He was excellent
Tyler helped me get everything right on my plan. He was very helpful. But unfortunately after he helped me my TV didn't work when I got home. So I called for customer service and I could not get anyone that spoke English. I was so frustrated. What's the point of hitting one for English? If you don't have anyone speaking English. I set up an appointment to have a check come out on Tuesday but tell me why. I've received five phone calls from Xfinity from people that can't speak English trying to resolve my problem. I can't even understand what they're saying to resolve the problem. It's so frustrating. I am so frustrated. I believe I'm done with Xfinity",1,25-Mar,59049
BP #59049 Vancouver,Store Experience | Staff | Appreciation,Joey was awesome.,5,25-Jan,59049
BP #59049 Vancouver,Store Experience | Staff | Appreciation,"Just wanted to say ""thank you"" to Eric who helped me today at the 16515 SE Mill Plain Blvd. location.  He updated my service as I noticed an increase in my statement and felt I could not afford it as it creeps up every year. He was ver helpful in finding me a plan that was perfect for my finances. Eric was most kind and friendly and helpful. He is an outstanding employee. My name is Betty Y, no longer Betty Russell.",5,25-Feb,59049
BP #59049 Vancouver,Store Experience | Staff | Appreciation,"Staff is very friendly and willing to help you find the most ""cost effective"" products.",5,25-Feb,59049
BP #59049 Vancouver,Store Experience | Staff | Behaviour Issues,"Worst customer service I have ever experienced. We came into Xfinity to buy a new phone for my grandmother, and our experience with Cheyenne terrible. We went there on Saturday to buy my grandma a new iPhone which she was very excited for. When we walked in Cheyenne coldly motion dust to her table. From the moment we started our interaction with her she was consistently short, rude and disrespectful. We were trying to see the difference between adding her phone to the bill and if we were just going to pay it outright. I asked the question On how much it would be altogether, including the phone, Internet, TV service, and phone plan, She responded with, “That’s a completely different conversation. We’re not talking about the Internet and TV. We’re talking about the phone.” Me and my grandma looked at each other in confusion because the way that she said it was completely rude and out of line. The rest of the interaction was nothing short of spectacular Between her eye rolling and her constant sighing, this has to be the worst customer service I’ve ever received at an Xfinity store. Shame on you, Cheyenne",1,25-Jan,59049
BP #59050 Lake Stevens,Store Experience | Customer Appreciation,Great experience at this location. I was assisted very quickly and my changes I requested were confirmed by the employee.,5,25-Feb,59050
BP #59050 Lake Stevens,Store Experience | Customer Dissatisfaction,"They lost a phone we returned and continued to charge us. Trying to get someone to deal with the situation took several phone calls and visits to the store. Still continue to charge us for a phone we haven't had for 4 months. Buyer beware.

UPDATE: I tried to do their reply and waited and waited and no answer. Par for the course. Steal your money and not respond.",1,25-Feb,59050
BP #59050 Lake Stevens,Store Experience | Customer Dissatisfaction,"Went in a few months back to pick up a modem, seemingly walked out with a whole extra internet service plan AND mobile plan to the same address which I did not ask for! 10 agents, 3 mobile ""cancellations"" later I notice I'm being double billed for services. Somehow picking up a modem for new service will also land you an extra account at this location.",1,25-Feb,59050
BP #59050 Lake Stevens,Store Experience | Staff | Appreciation,All staff greeted us as walking in. Very friendly and knowledgeable. We're helped right away left happy.,5,25-Feb,59050
BP #59050 Lake Stevens,Store Experience | Staff | Appreciation,Great customer service. Very friendly & helpful. I appreciate the location for us Lake Stevens customers.,5,25-Feb,59050
BP #59050 Lake Stevens,Store Experience | Staff | Appreciation,"I had a great experience at the Xfinity Store today! AJ was incredibly helpful and patient in answering all my questions. He made sure I understood everything clearly and went above and beyond to ensure my needs were met. Thank you, AJ, for your excellent customer service!",5,25-Jan,59050
BP #59050 Lake Stevens,Store Experience | Staff | Appreciation,"The young man that waited on us was amazing. Good help, good attitude.",5,25-Feb,59050
BP #59051 Kent,Store Experience | Not Recommended,"Buying a watch on Saturday was the worst mistake I ever made without realizing it. The representative connected my watch to the incorrect line, resulting in headaches and several trips to the same location over the course of two days to try and get it connected to the correct line. Their only option for fixing a mistake they made was to cancel my watch and lose out on a promotion that had no fault on the customer's part. They advised me to return the watch and wait for a fresh promotion to come out! The customer has to wait now due to an error from the Xfinity store member. I am against returning to this location and suggest that everyone drives down to Kent instead. Save yourself from the stress.",1,25-Mar,59051
BP #59051 Kent,Store Experience | Short Wait Time,Ali was great and very quick to help me switch my account and update my needs!,5,25-Feb,59051
BP #59052 Burlington,Store Experience | Customer Dissatisfaction,"Went there to pick up my Xfinity Gateway modem and router after recently signing up for service from Xfinity. Clerk took my Driver’s License(???) to the BACK of the store for some reason. Didn’t return with it. Had a busy day so I didn’t remember to ask for it again. First experience was terrible, disrespectful staff and people standing around on their phones doing nothing, not greeting or helping me. Came back the next day to get my license, was told to move to the back of the store because a clerk was helping a customer(????). People in the store all lining up for one seemingly competent worker, named Max, I think, and refusing to get service from other clerks. Thankfully, they had my license in the back of the store, I’m sure they wouldn’t be nice enough to mail it to my address anyways though. At least the woman who gave me my license back apologized, not that I can give her proper kudos because of course none of the employees are wearing name tags. The bill payment machine in the back is broken, and has been broken for months, too. TERRIBLE store, avoid at all costs.",1,25-Jan,59052
BP #59052 Burlington,Store Experience | Long Wait Time,"Quick customer service, as soon as I arrived. Walked in with equipment to return and I was out of there with a receipt in three mins!",5,25-Feb,59052
BP #59052 Burlington,Store Experience | Staff | Appreciation,Customer service was great 👍,4,25-Jan,59052
BP #59052 Burlington,Store Experience | Staff | Appreciation,"Person who worked with me and explained
what he was doing for me! FANTASTIC@!!",5,25-Jan,59052
BP #59052 Burlington,Store Experience | Staff | Behaviour Issues,"Excellent service! Fast, professional, friendly. God bless them!",5,25-Mar,59052
BP #59052 Burlington,Store Experience | Staff | Behaviour Issues,"Not friendly today. Romeo was the boss, trying to help everyone but not helping  anyone!  I always like this store, but today  No.",3,25-Jan,59052
BP #59053 Springfield,Store Experience | Customer Dissatisfaction,"If there were a zero, I would choose it!  They completely messed up my mobile account when I moved and added a line. The removed my 90 yr old Moms phone and somehow created a standalone account. My phone number couldn’t be found on the account at all.  They charged me $125/mo additional instead of $20/mo. In addition to my regular bill. No one could see the auto payments I was making. I had to dispute through the bank and change my card. Such a mess! When I tried to get help they just shut me down saying to go to my bank. It’s taken months to get resolved, not by the store. Still not sure it’s right. They are idiots over there. Have no idea what they’re doing.",1,25-Jan,59053
BP #59053 Springfield,Store Experience | Not Recommended,I recently left a review on this very sad company how they are taking my money and I haven't used them in a couple months.. it's been 3 months now and they are still deducting money from my account.. attention please do not use this company they will rob you.!!!,1,25-Jan,59053
BP #59053 Springfield,Store Experience | Staff | Appreciation,"I can’t express enough how thankful I am, through a tough situation, to have had the help of Jazmyn and Steven. They were the absolute best! Outstanding service!",5,25-Mar,59053
BP #59053 Springfield,Store Experience | Staff | Behaviour Issues,"Came here to drop off a modem for a family member that left the state to tend to a medical issue, and some guy with rotten teeth and terrible customer service would NOT let me simply drop off the modem to be returned to warehouse. I then had to drive to Valley River to simply drop the modem off! RIDICULOUS!!! Haven’t been back since and won’t be back!!!",1,25-Jan,59053
BP #59053 Springfield,Store Experience | Staff | Behaviour Issues,When you walk into a door a young man sitting on his phone goes to the other guys. There we got a live one very unprofessional.,2,25-Mar,59053
BP #59054 Yosemite,Store Experience | Customer Dissatisfaction,"First off. It’s a pain to get a hold of an agent in store over the phone. Took over 40 mins, still haven’t answered so now I have to go in store. Second, I got a charge of 70$ on my bank account for a mobile line that I never wanted. Told them multiple times I did not want the phone line and still got charged. Now they are not going to refund my money unless the store has a note saying I never wanted the line. Still trying to get this resolved bc I’m a sahm and they took the money out when I didn’t even have money on there so my account is in the negatives now thank to them. Third, we had issues with our WiFi so they told us to bring in the box to switch it out for a new one and we are still having issues with the new box.",1,25-Feb,59054
BP #59054 Yosemite,Store Experience | Customer Dissatisfaction,Worlds worst service I waited for 2hrs to drop off a device you need to hire more ppl,1,25-Mar,59054
BP #59054 Yosemite,Store Experience | Long Wait Time,Avoid Alan he's a worthless worker don't get his help he is a useless employee I should know since he had us waiting for almost 2 hours more than enough time to see how he operated I'll definitely make it know for here on out when I see him to report his disrespectful responses and his attitude to answer simple questions. Now Bruno is the guy to talk to get things done I appreciate you sir. Other than that get people who want to assist a customers not a worker who can't even understand basic questions or even understand how long someone is waiting to be assisted on even thoe my names on the sign in paper.,1,25-Jan,59054
BP #59054 Yosemite,Store Experience | Long Wait Time,"Xfinity Store Customer Service Review – Poor Experience

1. Lack of Customer Engagement:
Staff seemed uninterested and unapproachable. There was minimal effort to acknowledge customers upon entry or offer assistance.

2. Long Wait Times with No Clear Communication:
Wait times were excessive, and there was no clear system in place to manage customer flow. Employees did not provide updates or estimated wait times.

3. Unhelpful and Rushed Assistance:
When finally assisted, the representative seemed rushed and unwilling to provide detailed explanations. Questions were met with vague or dismissive responses.

4. Poor Problem-Solving Skills:
Employees lacked knowledge or initiative to resolve basic issues. Instead of troubleshooting, they directed customers to call support or visit another location.

5. Inconsistent Information:
Different employees gave conflicting answers regarding plans, promotions, and troubleshooting steps, leading to confusion and frustration.

6. Lack of Professionalism:
Some employees displayed an unprofessional attitude, appearing disinterested or even impatient with customer inquiries.

7. Lack of Sense of Urgency:
Staff did not prioritize customer concerns or show any urgency in resolving issues, even when problems were time-sensitive. Customers were left waiting unnecessarily.

8. Store Atmosphere & Cleanliness:
The store was disorganized, with limited seating and unclear signage. The overall environment felt unwelcoming.

Overall Rating: 1/5
The visit was frustrating due to poor service, lack of urgency, and an unhelpful staff. Improvements in training, customer engagement, and efficiency are needed.",1,25-Mar,59054
BP #59054 Yosemite,Store Experience | Staff | Appreciation,Staff was very patient and helpful. They got me set up in no time!,5,25-Mar,59054
BP #59055 Albuquerque,Store Experience | Customer Dissatisfaction,"Awful customer service, will never return to this location again.",1,25-Feb,59055
BP #59055 Albuquerque,Store Experience | Customer Dissatisfaction,"Try not to come here it is the worst place on earth just to simply return some old crappy modem that they charge you a service a month even though is not in use and it iis absolete. Takes 1 hour when they should have 2 or 3 cues depenging on what it is one is doing. Just for that i will cancel xfinity.
N then if you dont get confirmation for your equipment you returned they charge you full price.
This place is horrible. Try to avoid it if you can. Unless you wanna waste your time sitting down in shitty stools",1,25-Jan,59055
BP #59055 Albuquerque,Store Experience | Short Wait Time,Amazing customer service i was able to get in and out!,5,25-Mar,59055
BP #59055 Albuquerque,Store Experience | Staff | Appreciation,"Shout out toVincent who was beyond helpful, patient and kind when it came to the issues I was having with my phone. Thank you so much to him for helping me trouble shoot it and get it taken care of. I'm beyond happy with the care I got😁",5,25-Feb,59055
BP #59055 Albuquerque,Store Experience | Staff | Appreciation,Vincent was phenomenal answering my questions and helped guide me in the right direction!,5,25-Jan,59055
BP #59055 Albuquerque,Store Experience | Staff | Appreciation,Went on a Saturday. Took my dad to turn in his equipment. The staff was very friendly and professional.,4,25-Feb,59055
BP #59055 Albuquerque,Store Experience | Staff | Behaviour Issues,Went in there on Saturday hoping to get WiFi for my home and dealt with a very unprofessional little brown girl gloating about drinking and driving and literally had no clue what service she was trying to give me I then asked multiple employees what bundle she was trying to sell me and literally know one knew or could explain to me what the heck was going on so I ended up leaving without Internet and went to the Cutler location and everyone there was very professional and literally gave me exactly what I wanted shout out to Lalo Corbin at the Cutler location for being professional and knowledgeable,1,25-Feb,59055
BP #59055 Albuquerque,Store Experience | Staff | Manager Complaints,"This store has me out $200 on an iPhone upgrade coupon because the associate Guillermo did not do it right and was rushing. I went into the store to try to get it resolved and the store manager gave me a bunch of attitude and never acknowledged me again. I escalated this with Xfinity Executive Relations and they told me I never applied to coupon during my sale so they also cannot help me. Horrible location, horrible company. Do not use this service for mobile or buying phones. I am paying full price for something so many other places were offering with savings.",1,25-Jan,59055
BP #59056 Albuquerque,Store Experience | Customer Dissatisfaction,"Not real impressed with Xfinity customer service so far. The agents on the phone tell you one thing, then you go to the store and what I was told isn't true.",3,25-Feb,59056
BP #59056 Albuquerque,Store Experience | Customer Dissatisfaction,This office was closed when I got there when Google mama says it’s open.,1,25-Feb,59056
BP #59056 Albuquerque,Store Experience | Short Wait Time,The service was fast and they fixed my issue right way,5,25-Mar,59056
BP #59056 Albuquerque,Store Experience | Staff | Appreciation,"Awesome staff!! Super friendly and helpful, was in and out and they were super kind. I highly recommend this store!",5,25-Feb,59056
BP #59056 Albuquerque,Store Experience | Staff | Appreciation,Daniel was a great help! Very professional and friendly.,5,25-Feb,59056
BP #59056 Albuquerque,Store Experience | Staff | Appreciation,"If you go to the Cottonwood store, ask for Daniel! He is an gel, very helpful and patient. He made recommendations to improve my service and implementing the changes was painless. Good experience.",5,25-Jan,59056
BP #59056 Albuquerque,Store Experience | Staff | Manager Complaints,"Horrible communication and no sense of customer service. The only helpful associate we encountered was Daniel. He was patient, knowledgeable, and walked us through the process for our phone trade-in and transfer. We needed two transactions. The other account holder was not present so we did what we could with the one and returned as instructed to complete the process. Not only could we not complete the process, but the young boy (Corbin) that ""helped"" us and the ""assistant manager"" in the back (Nate) said even with the account holder now present we had to leave and call the Xfinity number for help. They could not do anything. Even upon trying to take care of the trade-in, they said they could not do it for 24 hours. Lovely. Not the steps of direction we have been given during our first actually helpful visit. We had scheduled the time to get both account holders to the store only to be told by two kids that their assistant manager said nothing could be done there. GM- Nate: train the kids in your store to do better. The Xfinity card says ""Simple. Easy. Awesome."" It was ""Unclear. Difficult. Horrible.""",1,25-Jan,59056
BP #59056 Albuquerque,Store Experience | Staff | Manager Complaints,"I've been to the store a handful of times, and have generally received good service at the store. The reps are nice enough, and can usually service my questions without much hassle.

I've recently had an experience where twice I was told by an assistant manager that a manager would reach out to discuss an issue I've had, to no actual phone call.

I've been led to believe that Management's strstegy for handling customer issues is to ignore them long enough that the customer finds it too much hassle to even continue to follow up.

I'm happy to change my mind if local management wishes to actually follow up.",3,25-Mar,59056
BP #59057 Sand City,Store Experience | Staff | Appreciation,"I’ve been W Comcast / Xfinity for 8 years . . And they always been helpful and they’re doing their jobs . . Obviously they gotta hustle to make money . . But that’s why you go and ask For Gabriel 😎  . . He always been helping me w my equipment and he’s honest and professional. My bill went up to 135 a month and He helped me to drop it to 70 dollars . . If you go to sand city , ask for GABRIEL. He’s the guy !",5,25-Feb,59057
BP #59057 Sand City,Store Experience | Staff | Manager Complaints,Terrible customer service. Have been in the store 3 times in the last 2 weeks and the issue with setting up a new cell phone account has yet to be resolved. The manager refuses to contact me. The 2 reps in the store that I dealt with were both dishonest with me. These people are con artists and hustlers. I’ve been left in limbo with nowhere to turn.  After all of this I contacted customer service which is a joke. Worked with an agent for almost 2 hours and then said he’d call me back the next day to finish the process of setting up my account. It’s 2 days later and still have yet to hear from him.  Can someone tell me what to do now??,1,25-Feb,59057
BP #59058 Los Banos,Store Experience | Staff | Appreciation,Daisy was great. My husband and I went in to get internet  services and she was very knowledgeable and professional. I haven’t had customer service like this in a while!,5,25-Feb,59058
BP #59058 Los Banos,Store Experience | Staff | Manager Complaints,"Customer service was the worst experience that I ever experienced with Xfinity. The manager Miguel Leal was very difficult to work with him and his staff were extremely rude . whole time I was in the store asking for help. And nobody wanted to help , I literally had to call Xfinity Customer support. I will never recommend Xfinity Los Banos store !",1,25-Jan,59058
BP #59059 Petaluma,Store Experience | Staff | Appreciation,"Super friendly staff. No waiting time, got what I needed it resolved. Overall a really pleasant experience",5,25-Feb,59059
BP #59060 Mill Creek,Store Experience | Customer Dissatisfaction,Asia was so professional and patient.  This was my first visit to this store. I would return  and tell other people  to use this business.,5,25-Jan,59060
BP #59060 Mill Creek,Store Experience | Long Wait Time,I spent 1.40 hours in this place. I think that's a lot for connecting high-speed Internet. The staff was nice and friendly but i had to wait too long,3,25-Jan,59060
BP #59060 Mill Creek,Store Experience | Staff | Appreciation,Irish helped right away I got a new modem for my internet they were awesome thank you,5,25-Jan,59060
BP #59061 Beaverton,Store Experience | Long Wait Time,"On Tuesday, February 4, around 3 p.m., I visited the Xfinity Store on Cedar Hills Blvd and Walker Rd. I was greeted by Sam Mendosa. He spoke in a very soft voice and listened to my questions regarding my monthly invoice. After asking questions about what we watch on TV and how we use our internet, he had several suggestions. We had features/services on our account that we're not using.  He made some changes that made a lot os sense, so I went forwards.   This whole task took maybe 20 minutes at the best.   Sam is very knowledgeable, speaks very clearly, soft voice. I was very very happy with the in-person service vs over the telephone.   Sam is a valuable asset.",5,25-Feb,59061
BP #59061 Beaverton,Store Experience | Not Recommended,"I came to this store yesterday with my brother, and there was a good promotion, so my brother decided to take that promotion.

There is a promotion where you can get a free phone, but when I first asked my brother about it, he said he didn't want to contract it and didn't want to take it.

But a little later, my brother changed his mind and said he would take the free call.

However, the salesperson who helped him with this process took so long that everything was delayed a lot.
And she didn't even listen to his saying he would take the phone, and later she said, ' your sister said he refused'.
Even if I had spoken, she didn't listen to what he asked for.
Since it was almost closing time, the salesperson said he would do it when he came tomorrow morning.

This morning,
My brother closed his store and went there when the store opened.
but the manager said that since he had already open a phone line yesterday, he couldn't receive the free phone promotion today. The reason was that he was already a customer of this company. This promotion was for new customers.
My brother doesn't speak English well, and he had to go to work, so he just came back.

I don't really understand. Why should we suffer losses due to the salesperson's mistake?
The more I think about it, the more angry I get.
I don't know if other Xfinity stores are like this, but I really don't recommend this area.",1,25-Jan,59061
BP #59061 Beaverton,Store Experience | Staff | Appreciation,We got really excellent help switching from T-Mobile internet and phone lines to Xfinity. A young man named Memo helped us out with this. He was very patient and professional as it was a bit difficult to retrieve our transfer pins from the last provider. Thanks Memo! You’re the best! I’ve seen some negative reviews here but our experience was overwhelmingly positive. I’ll recommend this service to friends.,5,25-Feb,59061
